,id,permalink,username,text,date,parola_cercata,location,area,citta,raggio
413,1372452301382823936,https://twitter.com/SAZTSMITH/status/1372452301382823936,SAZTSMITH,"So, despite several EU countries halting use of Astra Zeneca vaccine, @vonderleyen is still threatening to block exports of it to UK? ‘ I don’t want to play with this toy, but you can’t have it either’ Feels a little embittered to me! #AstraZeneca #EU #vaccine #UrsulavonderLeyen",2021-03-18,AstraZeneca,GB-SUD,GB,London,200km
414,1372399033239625730,https://twitter.com/UB5simon/status/1372399033239625730,UB5simon,"Both Pfizer and AstraZeneca deny disruption in supplies. Therefore any disruption to the programme should have been obvious from the start surely?
https://t.co/a1feskL7iu",2021-03-18,AstraZeneca,GB-SUD,GB,London,200km
415,1372337588812455945,https://twitter.com/Pairsonnalites/status/1372337588812455945,Pairsonnalites,"AstraZeneca Vax Flops Against South African Variant in Early Trial: Previously, pooled efficacy data on the AstraZeneca vaccine from the U.K., Brazil, and South Africa, prior to B.1.351's emergence, showed overall ... https://t.co/HSixTWjyQi",2021-03-18,AstraZeneca,GB-SUD,GB,London,200km
416,1372299543983837188,https://twitter.com/DNeuroimaging/status/1372299543983837188,DNeuroimaging,I had my vaccine (Astra Zeneca) yesterday morning. I can report that today I have felt exhausted and fatigued. Therefore exactly the same as most days in the last 12 months...,2021-03-17,AstraZeneca,GB-SUD,GB,London,200km
417,1372274259138125830,https://twitter.com/Mattl_w/status/1372274259138125830,Mattl_w,Isn’t this the same AstraZeneca vaccine the EU were demanding we give them some of? Now they’re refusing to have it? 🤣🤣🤣 @vonderleyen is an absolute joke. The EU have never looked so stupid. RIP EU #AstraZenaca #EU #CovidVaccine #COVID19 #coronavirus,2021-03-17,AstraZeneca,GB-SUD,GB,London,200km
418,1372271617745821709,https://twitter.com/UB5simon/status/1372271617745821709,UB5simon,"It's Sanofi that the EU should really be angry about, not AstraZeneca. However, it would highlight a domestic failure. They bet heavily on a French company that didn't deliver the goods.
https://t.co/dur0E0LqKA",2021-03-17,AstraZeneca,GB-SUD,GB,London,200km
419,1372268639538221059,https://twitter.com/BritishHeraldUK/status/1372268639538221059,BritishHeraldUK,Britain’s health minister refuses to accept #EUcriticism on AstraZeneca vaccine exports https://t.co/88nKzTTgNy,2021-03-17,AstraZeneca,GB-SUD,GB,London,200km
420,1372261970238267394,https://twitter.com/TheSki_Guru/status/1372261970238267394,TheSki_Guru,"#vaccine #done #astrazeneca @ London, United Kingdom https://t.co/lWzx9gTACe",2021-03-17,AstraZeneca,GB-SUD,GB,London,200km
421,1372202498421833730,https://twitter.com/EleanorMills/status/1372202498421833730,EleanorMills,Am just off to get my (no doubt) AstraZeneca Covid vaccination and am very grateful to live in a country where it is available free to everyone on the NHS. On this we should feel proud. And I do!,2021-03-17,AstraZeneca,GB-SUD,GB,London,200km
422,1372201788556914692,https://twitter.com/viraltvgh/status/1372201788556914692,viraltvgh,"Lagos state government releases list of 88 centers where residents can take COVID19 AstraZeneca vaccine

The 88 centres cut across all 20 Local Governments of the State. https://t.co/xxC04p67O4",2021-03-17,AstraZeneca,GB-SUD,GB,London,200km
423,1372191352834887680,https://twitter.com/schneideman331/status/1372191352834887680,schneideman331,#astrazeneca #covid #vaccine #sciencefiction @ Science Museum https://t.co/QENTU51Hy6,2021-03-17,AstraZeneca,GB-SUD,GB,London,200km
424,1372179093224062976,https://twitter.com/Mazza6069/status/1372179093224062976,Mazza6069,"The 5 tests 
As relevant today as always
#EU
#UrsulavonderLeyen
#vaccine 
#AstraZeneca https://t.co/T8T6OcKRXi",2021-03-17,AstraZeneca,GB-SUD,GB,London,200km
425,1372148731236220938,https://twitter.com/lelalondon/status/1372148731236220938,lelalondon,"This is im-por-tan-te.

I've had no blood clots, even as a type 1 diabetic, after receiving the Oxford AstraZeneca vaccine.

I had multiple blood clots, which left me literally and permanently blind in one eye, after being put on the combined pill.

Get vaccinated. 🙏 https://t.co/8xSYD5riG7",2021-03-17,AstraZeneca,GB-SUD,GB,London,200km
426,1372133443304308737,https://twitter.com/carymarsh/status/1372133443304308737,carymarsh,#AstraZeneca me up! https://t.co/R27PAG52Gr,2021-03-17,AstraZeneca,GB-SUD,GB,London,200km
427,1372117246533898244,https://twitter.com/L_AsaiahAsher/status/1372117246533898244,L_AsaiahAsher,"It's amazing how Western science went on for decades to try and disprove the existence of God but can't handle the scrutiny of the Oxford AstraZeneca vaccine blood clotting side effect...

#OxfordAstraZeneca #AstraZeneca #COVID19 #vaccination",2021-03-17,AstraZeneca,GB-SUD,GB,London,200km
428,1372113577570603009,https://twitter.com/NatachaHorn/status/1372113577570603009,NatachaHorn,After effect first jab 💉🤪 #CovidVaccine #AstraZeneca https://t.co/o1uQCtgDwS,2021-03-17,AstraZeneca,GB-SUD,GB,London,200km
429,1372097625219072002,https://twitter.com/amedeo_felix/status/1372097625219072002,amedeo_felix,"This alleged AstraZeneca blood clot issue... There's been 37 cases, but 17 million doses of vaccine. I put that into a calculator and it comes to one in five million. So even if there's a cause and effect relationship it's infinitesimal. What's wrong with people?!",2021-03-17,AstraZeneca,GB-SUD,GB,London,200km
430,1371979657659219969,https://twitter.com/DefoesInvest/status/1371979657659219969,DefoesInvest,More #EU nations #suspend #AstraZeneca shot as #regulator says #benefits still #outweigh the #risks | Defoes  https://t.co/sUBC0o2CXc,2021-03-17,AstraZeneca,GB-SUD,GB,London,200km
431,1371969302929215489,https://twitter.com/themedicaldon/status/1371969302929215489,themedicaldon,Excellent thread 👉- puts the ‘risk’ of @AstraZeneca vaccine in perspective. Risk of delaying vaccine rollout from this is hugely greater than any thromboembolic risk https://t.co/TArGEWDOea,2021-03-16,AstraZeneca,GB-SUD,GB,London,200km
432,1371946505851047936,https://twitter.com/RegenerateAndy/status/1371946505851047936,RegenerateAndy,My dishwasher packed up literally 2 weeks after I had the AstraZeneca vaccine.  I just had to nip out to the garage for emergency fairy liquid. https://t.co/laYQ8lRPDH,2021-03-16,AstraZeneca,GB-SUD,GB,London,200km
433,1371924547621023751,https://twitter.com/jamesglynn/status/1371924547621023751,jamesglynn,And they have paused using the Oxford/AstraZeneca vaccine https://t.co/r7OcFhGSHI,2021-03-16,AstraZeneca,GB-SUD,GB,London,200km
434,1371908509260910593,https://twitter.com/BritishHeraldUK/status/1371908509260910593,BritishHeraldUK,"AstraZeneca use suspended by European states, Oil drops https://t.co/2u7kLWYaiy",2021-03-16,AstraZeneca,GB-SUD,GB,London,200km
435,1371907889758150658,https://twitter.com/whmicha6/status/1371907889758150658,whmicha6,Maybe the EU population should start asking questions of the MEPs about why they have decided to suspended the AstraZeneca vaccine now the EMA and the WHO have said that there is no valid reason to do so. ?,2021-03-16,AstraZeneca,GB-SUD,GB,London,200km
436,1371896469029015552,https://twitter.com/whmicha6/status/1371896469029015552,whmicha6,It’s clear that the EUs decision to halt the vaccinations using AstraZeneca is purely politically motivated . Shameful behaviour using the lives of its people for political purposes.,2021-03-16,AstraZeneca,GB-SUD,GB,London,200km
437,1371889762680864770,https://twitter.com/mjcben148/status/1371889762680864770,mjcben148,Lovely day for it! #1stdose #AstraZeneca #vaccine #getin ! https://t.co/ZpAYkZUrSU,2021-03-16,AstraZeneca,GB-SUD,GB,London,200km
438,1371886203641937922,https://twitter.com/thistle5460/status/1371886203641937922,thistle5460,"If Europe doesn’t want vaccine, can’t we get out out to the rest of the world regardless? #AstraZeneca",2021-03-16,AstraZeneca,GB-SUD,GB,London,200km
439,1371875518962876416,https://twitter.com/Loofah57060/status/1371875518962876416,Loofah57060,"BBC News - AstraZeneca vaccine: EU regulator 'firmly convinced' benefits outweigh risks
https://t.co/Hq9NBXXVDN",2021-03-16,AstraZeneca,GB-SUD,GB,London,200km
440,1371869809370001411,https://twitter.com/minisweed/status/1371869809370001411,minisweed,"#AstraZeneca for me!! @ London, United Kingdom https://t.co/2r6BAVCPsv",2021-03-16,AstraZeneca,GB-SUD,GB,London,200km
441,1371866346598830082,https://twitter.com/simonplatman/status/1371866346598830082,simonplatman,I got an Astra Zeneca. Just waiting for Vauxhall to deliver it. https://t.co/3KlC00821n,2021-03-16,AstraZeneca,GB-SUD,GB,London,200km
442,1371864614158368777,https://twitter.com/sallyalp2000/status/1371864614158368777,sallyalp2000,It’s now 24 hours since my first AZ COVID injection. I’m still standing. Have a sore arm!!  But then again I had a sore arm when I had my flu jab in December. Do woman/man up get your jab &amp; get back to normality #vaccinated #Oxford-AstraZeneca #VaccinesWork #,2021-03-16,AstraZeneca,GB-SUD,GB,London,200km
443,1371850725756649482,https://twitter.com/LeonFDelCanto/status/1371850725756649482,LeonFDelCanto,"I’ll have my @AstraZeneca vaccine next week without reservations. It is important that we reach herd immunity as a country asap. Vaccination is the only sensible way to stop #Coronavirus, even if there is a small side effect risk (negligible) https://t.co/4PQX7PTpTq",2021-03-16,AstraZeneca,GB-SUD,GB,London,200km
444,1371847712421912580,https://twitter.com/ed_verita/status/1371847712421912580,ed_verita,COVID-19: European regulator says 'no indication' Oxford-AstraZeneca jab is cause of blood clots | UK News | Sky News https://t.co/IzzPahn1JO - this is good news. #AstraZenaca #COVID19Vaccine #patientsafety #vaccination,2021-03-16,AstraZeneca,GB-SUD,GB,London,200km
445,1371836455211913217,https://twitter.com/Marie62100602/status/1371836455211913217,Marie62100602,Data show the number of people reporting blood clots after #Pfizer or #AstraZeneca's jabs is almost identical. Neither is higher than  normally expected. According to the #WorldHealthOrganisation #WHO there is no evidence to suggest blood clots have been caused by either #vaccine https://t.co/dN5xMZ9n4X,2021-03-16,AstraZeneca,GB-SUD,GB,London,200km
446,1371835568045355014,https://twitter.com/qeensdale/status/1371835568045355014,qeensdale,"They don't like #Boris i wonder why?
#Justasking 

MPs and WHO plead with Britons to keep taking 'safe' AstraZeneca jabs https://t.co/dnXyUG3qOK @MailOnline",2021-03-16,AstraZeneca,GB-SUD,GB,London,200km
447,1371811787327336450,https://twitter.com/PatrickRedknap/status/1371811787327336450,PatrickRedknap,"#Astrazeneca Day 4. 
Day 3 turned out to be the worst day but I feel much better today. Still got sweats and arm is sore AF. 
Don’t be a wuss. Get the vaccine people!",2021-03-16,AstraZeneca,GB-SUD,GB,London,200km
448,1371810088411828227,https://twitter.com/N16Breda/status/1371810088411828227,N16Breda,"A very useful read here for anyone with concerns about AstraZeneca news reports.
I am beyond happy to be getting my first AZ vaccination this afternoon 😀
https://t.co/tiO2mpUENh",2021-03-16,AstraZeneca,GB-SUD,GB,London,200km
449,1371805297455554561,https://twitter.com/Goonerlover69/status/1371805297455554561,Goonerlover69,"Is Europe's AstraZeneca jab decision-making flawed? https://t.co/MN0xlRAZJT
These idiots are playing with their peoples lives!
👏🏼👏🏼👏🏼Congratulations Europe as you go into the 3rd covid wave you pick up the award for stupidity! 🏆Point scoring on the highest level!🤨",2021-03-16,AstraZeneca,GB-SUD,GB,London,200km
450,1371801039314243586,https://twitter.com/UB5simon/status/1371801039314243586,UB5simon,"The evidence on which decisions about the AstraZeneca vaccine have been based seem very thin, but the only people apportioning it to nationalism seem to be nationalists.",2021-03-16,AstraZeneca,GB-SUD,GB,London,200km
451,1371791634430574592,https://twitter.com/ollybarratt/status/1371791634430574592,ollybarratt,"Just one illustration of the impact elsewhere in the world of the European pause in using the AstraZeneca jab. 

Here's a vox our team in Kinshasa gathered today (DRC has also paused its AZ rollout): https://t.co/Rah61N2WEh",2021-03-16,AstraZeneca,GB-SUD,GB,London,200km
452,1371784717381554177,https://twitter.com/Veronica_Foote_/status/1371784717381554177,Veronica_Foote_,Great fact based explanation of what is going with the #AstraZeneca #astrazenecavaccine #vaccino https://t.co/0GMTfI4m63,2021-03-16,AstraZeneca,GB-SUD,GB,London,200km
453,1371774571272151041,https://twitter.com/lxssio/status/1371774571272151041,lxssio,It looks as if an awful lot of people on here think that their layman opinion on the safety of the AstraZeneca vaccine is of relevance to others 😭,2021-03-16,AstraZeneca,GB-SUD,GB,London,200km
454,1371772025476419584,https://twitter.com/Paulsturdyyaho1/status/1371772025476419584,Paulsturdyyaho1,"Well we see the true face of the E.U.  they would put there people at a disadvantage in the fight against Covid 19 , rather than use the OXFORD AstraZeneca vaccine. # glad we voted leave.",2021-03-16,AstraZeneca,GB-SUD,GB,London,200km
455,1371771023293550592,https://twitter.com/footymum73/status/1371771023293550592,footymum73,"With all the talk of people worried about having the covid vaccine, I'm very happy to have had my 1st jab yesterday. Had AstraZeneca/Oxford and feel absolutely fine! 👍🏼 #OxfordAstraZeneca",2021-03-16,AstraZeneca,GB-SUD,GB,London,200km
456,1371764229301272582,https://twitter.com/TalieDelemere/status/1371764229301272582,TalieDelemere,Got my vaccine this morning and the beyond lovely lady doing it said that people are now feeling funny about getting the AstraZeneca dose 😣I really hope it doesn't put lots of people off.,2021-03-16,AstraZeneca,GB-SUD,GB,London,200km
457,1371762815883743234,https://twitter.com/ThatKidFromJoey/status/1371762815883743234,ThatKidFromJoey,"If you round up the percentage chance of getting blood clots from the AstraZeneca vaccine by three decimal points, it would be 0%.",2021-03-16,AstraZeneca,GB-SUD,GB,London,200km
458,1371762060619624448,https://twitter.com/afshinrattansi/status/1371762060619624448,afshinrattansi,"NATO ""security allies""

""The US has no plans to share its stockpile of AstraZeneca’s Covid-19 vaccine with other countries despite requests from the European Union"" 

https://t.co/Q6hts6c0vz",2021-03-16,AstraZeneca,GB-SUD,GB,London,200km
459,1371760690239770626,https://twitter.com/RoySheriff/status/1371760690239770626,RoySheriff,"So pleased to have had my #AstraZeneca jab yesterday Unfortunately for @vonderleyen and @EmmanuelMacron and the rest of the EU the Oxford jab has not caused me any blood clots and I am alive and well. Stop silly politics, vaccinate and save lives. #COVID19Vaccine #VaccineForAll",2021-03-16,AstraZeneca,GB-SUD,GB,London,200km
460,1371758351944650756,https://twitter.com/RHMPhotographic/status/1371758351944650756,RHMPhotographic,Got my first Oxford AstraZeneca COVID-19 vaccination this morning at Guy’s and stopped in the #HyundaiTunnelOfLight while I was waiting @ Guy's Hospital https://t.co/76yrTn3wBH,2021-03-16,AstraZeneca,GB-SUD,GB,London,200km
461,1371756684645908480,https://twitter.com/Naznet247/status/1371756684645908480,Naznet247,Stop 🚫 giving AstraZeneca Covid-19 Vaccine to Africans https://t.co/sOJgXfmk7S,2021-03-16,AstraZeneca,GB-SUD,GB,London,200km
462,1371756517284843520,https://twitter.com/daisystephens90/status/1371756517284843520,daisystephens90,"Countries suspending the #AstraZeneca jab when there's no data suggesting it causes blood clots, undermining already pretty fragile trust in #covid vaccines. I can't work out where this slightly hysterical reaction is coming from - am I missing something?",2021-03-16,AstraZeneca,GB-SUD,GB,London,200km
463,1371755754017980419,https://twitter.com/RezxoShaw/status/1371755754017980419,RezxoShaw,EU’s behaviour over Astra Zeneca vaccine amply shows the anti-uk sentiment prevailing in EU countries. Why should we nit Chuck all the EU trash out of UK n  start imposing massive import fees in German cars n Eu imports? They should pay double shipping fee . @stopbullyEU,2021-03-16,AstraZeneca,GB-SUD,GB,London,200km
464,1371751862978932736,https://twitter.com/swilsonnews/status/1371751862978932736,swilsonnews,"So, that's nine European countries (and several tweeters) that can't read. 
17m+ people vaccinated. 15 cases of DVT. 22 cases of pulmonary embolism. Usual rate of DVT and PE is 1/1000 each. That's 500x greater than the rate among those who've received the #AstraZeneca #vaccine. https://t.co/0C6OdRZQYv",2021-03-16,AstraZeneca,GB-SUD,GB,London,200km
465,1371747900213104640,https://twitter.com/LauraHolland/status/1371747900213104640,LauraHolland,"I don’t want to jinx it, but have woken up feeling fine. #AstraZeneca",2021-03-16,AstraZeneca,GB-SUD,GB,London,200km
466,1371726157536768000,https://twitter.com/itsnadine_/status/1371726157536768000,itsnadine_,Guys this AstraZeneca has fucked me up. I woke up at 1am shaking and now I can’t move my left arm.,2021-03-16,AstraZeneca,GB-SUD,GB,London,200km
467,1371720220302249987,https://twitter.com/Durmanator/status/1371720220302249987,Durmanator,"More good reporting on the @AstraZeneca vaccine by @statnews. “Experts are worried that decisions by multiple countries to suspend the vaccine’s use could  make it harder to convince people to receive it.”

The curious case of AZ’s Covid-19 vaccine https://t.co/PCGsyIh1Sx",2021-03-16,AstraZeneca,GB-SUD,GB,London,200km
468,1371614214700167169,https://twitter.com/Pairsonnalites/status/1371614214700167169,Pairsonnalites,"The Pope Opened the Door to Gay Unions, the Vatican Just Slammed it Shut: The UK has administered more than 25 million vaccine doses - many of the AstraZeneca shot - without raising any alarms over clotting and the UK's ... https://t.co/rwunojT6Ud",2021-03-16,AstraZeneca,GB-SUD,GB,London,200km
469,1371603267713695744,https://twitter.com/AdamLake/status/1371603267713695744,AdamLake,"'If you vaccinate 100,000 people over the age of 50 today rather than tomorrow, you save 15 lives, according to a French analysis. Germany has 1.7 million AstraZeneca doses that are now not being administered. Delay all of those by a week, you're up 1785 deaths.' https://t.co/nB63wtSfI8",2021-03-15,AstraZeneca,GB-SUD,GB,London,200km
470,1371599633089236992,https://twitter.com/Veronica_Foote_/status/1371599633089236992,Veronica_Foote_,"Excellent well written fact based article on #astrazenecavaccine 

#AstraZeneca #facts #vaccine #VaccinoAstrazeneca 

https://t.co/YjwGxZ2vX6",2021-03-15,AstraZeneca,GB-SUD,GB,London,200km
471,1371598340438253568,https://twitter.com/lxssio/status/1371598340438253568,lxssio,The entire UK when it hears about the AstraZeneca vaccine being suspended by multiple countries in Europe: https://t.co/ZNCffjFPEf,2021-03-15,AstraZeneca,GB-SUD,GB,London,200km
472,1371587257912672264,https://twitter.com/petermbenglish/status/1371587257912672264,petermbenglish,Thread by @olivernmoody: Awful lot of criticism on here of Germany's decision to suspend the use of AstraZeneca. I'm not going to add to it because I'm not an epidemiologist. But some numbers may be useful...… https://t.co/QdTqEUb7Pk,2021-03-15,AstraZeneca,GB-SUD,GB,London,200km
473,1371586547544436737,https://twitter.com/SekeramMohan/status/1371586547544436737,SekeramMohan,Does AstraZeneca vaccine cause blood clots ? Evidence available does not suggest the vaccine is the cause ☝🏾please continue to het your vaccine @projecthalo @AgamaSedina @DrNighatArif @anwar_shamaila @MartinWhelton @barry_causer @DrAmirKhanGP https://t.co/koAQSM5Cga,2021-03-15,AstraZeneca,GB-SUD,GB,London,200km
474,1371583877832187904,https://twitter.com/markmgardner/status/1371583877832187904,markmgardner,The more I read.....the more I believe this to be an embarrassing attempt by the EU to rock the #UK vaccination success. Detracting from the #EU failings...we are run by silly children. #AstraZeneca #Covid_19,2021-03-15,AstraZeneca,GB-SUD,GB,London,200km
475,1371568779541549060,https://twitter.com/Newsminster/status/1371568779541549060,Newsminster,Germany suspends use of AstraZeneca vaccine following reports of health concerns https://t.co/zxvxIDqMVD https://t.co/UEEUZB4WO5,2021-03-15,AstraZeneca,GB-SUD,GB,London,200km
476,1371547666006544385,https://twitter.com/petermbenglish/status/1371547666006544385,petermbenglish,"Brilliant Thread by @Felicea on the bizarre German decision, at the cost of German lives to suspend use of the  #AstraZeneca Covid vaccine. (In German, but machine translation works well).  https://t.co/0LFiwJFKlM",2021-03-15,AstraZeneca,GB-SUD,GB,London,200km
477,1371524217406111750,https://twitter.com/danielpageactor/status/1371524217406111750,danielpageactor,"I get a blood clot just thinking about having a McDonald’s..!!!
#AstraZeneca #astrazenecavaccine 
P.S I’m getting serious vaccine FOMO #pettyeurope",2021-03-15,AstraZeneca,GB-SUD,GB,London,200km
478,1371522904995823618,https://twitter.com/JeremyClarkson/status/1371522904995823618,JeremyClarkson,I had the Astra Zeneca vaccine yesterday and my blood is still a liquid. So it’s fine.,2021-03-15,AstraZeneca,GB-SUD,GB,London,200km
479,1371516358085771264,https://twitter.com/Innovandiamo/status/1371516358085771264,Innovandiamo,There's no proof the Oxford vaccine causes blood clots. So why are people worried? | David Spiegelhalter #AstraZeneca https://t.co/3K8rpVxQ85,2021-03-15,AstraZeneca,GB-SUD,GB,London,200km
480,1371475392251449347,https://twitter.com/kennylethorn/status/1371475392251449347,kennylethorn,"Hey there , don’t know if this is old news , but I’ve just watched an interview where they said GOOGLE have ties to Astra Zeneca . Could that be one of the reasons for de platforming anyone with alternative ideas on what’s really going on ? https://t.co/54mHHYkpxY",2021-03-15,AstraZeneca,GB-SUD,GB,London,200km
481,1371432904023285760,https://twitter.com/TeriCarson/status/1371432904023285760,TeriCarson,"'Casual'‼️⁉️⁉️

""There is no causal link between the Oxford-AstraZeneca COVID-19 vaccine and blood clots, according to medical experts""  https://t.co/9z5ON0QC0C",2021-03-15,AstraZeneca,GB-SUD,GB,London,200km
482,1371407900963393537,https://twitter.com/fionawhitenurse/status/1371407900963393537,fionawhitenurse,Making vaccines at the Wilson today with another St. George’s student. AstraZeneca today  which is a safe vaccine lots of queries about blood clots and patients happily  reassured . #COVID19 #teammerton #CovidVaccine https://t.co/1hVyptONK1,2021-03-15,AstraZeneca,GB-SUD,GB,London,200km
483,1371399880392982528,https://twitter.com/JamesStewartEC2/status/1371399880392982528,JamesStewartEC2,"My first trip to a museum since lockdown. I’m so grateful to have received my first @AstraZeneca vaccine. Thanks to all involved, no queue and was in and out in 20 minutes. #covidvacccine #AstraZeneca #nhsheroes https://t.co/4IyeJ7pwgR",2021-03-15,AstraZeneca,GB-SUD,GB,London,200km
484,1371391514778144768,https://twitter.com/traumagasdoc/status/1371391514778144768,traumagasdoc,"I wonder how many lives will be lost by the “precautionary” suspension of #AstraZeneca vaccinations in those countries with a high covid transmission rate like the Netherlands? 

Getting the population vaccinated as soon as humanly possible has to be the overriding priority.",2021-03-15,AstraZeneca,GB-SUD,GB,London,200km
485,1371381921024905222,https://twitter.com/BritishHeraldUK/status/1371381921024905222,BritishHeraldUK,"Safety concerns are over, Thailand to start administering #AstraZeneca https://t.co/YimwQ0iJqD",2021-03-15,AstraZeneca,GB-SUD,GB,London,200km
486,1371357926053531648,https://twitter.com/ezzye/status/1371357926053531648,ezzye,"The Medicines and Healthcare products Regulatory Agency said evidence ""does not suggest"" the jab causes clots.

BBC News - Covid-19: Evidence does not suggest AstraZeneca jab linked to clots, MHRA says
https://t.co/9XWSUxAunq",2021-03-15,AstraZeneca,GB-SUD,GB,London,200km
487,1371233122881265672,https://twitter.com/soler_alfredo/status/1371233122881265672,soler_alfredo,Ireland also suspends the rollout of the AstraZeneca vaccine https://t.co/2KD9iVq22h,2021-03-14,AstraZeneca,GB-SUD,GB,London,200km
488,1371200846927564802,https://twitter.com/BritishHeraldUK/status/1371200846927564802,BritishHeraldUK,#Astrazeneca suspended in Ireland due to blood clotting issues https://t.co/jC88QbSltd,2021-03-14,AstraZeneca,GB-SUD,GB,London,200km
489,1371180665903984641,https://twitter.com/TeriCarson/status/1371180665903984641,TeriCarson,"""The Oxford-AstraZeneca COVID-19 vaccine has been suspended in the Republic of Ireland""  https://t.co/BDUkrKFYvb",2021-03-14,AstraZeneca,GB-SUD,GB,London,200km
490,1371124096130551809,https://twitter.com/spencersuckling/status/1371124096130551809,spencersuckling,Because no one gives a toss🤬 Awaiting the 4th Wave #coviduk or they are mass testing the #vaccine #AstraZeneca on the population 🤔 😷🌈😷 https://t.co/tl6urKeVAE,2021-03-14,AstraZeneca,GB-SUD,GB,London,200km
491,1371099394880249859,https://twitter.com/annarella_doc/status/1371099394880249859,annarella_doc,"For all the Countries that are now suspending #AstraZeneca vaccine: I want to give you a news. Covid vaccines have not been thought to give immortality.
#COVID19 
#vaccineterror
#astrazenecavaccine",2021-03-14,AstraZeneca,GB-SUD,GB,London,200km
