id,permalink,username,text,date
1244908195849658370,https://twitter.com/Editwit/status/1244908195849658370,Editwit,"J&amp;J, Moderna sign deals with U.S. to produce huge quantity of possible coronavirus vaccines https://t.co/2VDuj1CNMx",2020-03-31
1244898456382160896,https://twitter.com/virtualgr/status/1244898456382160896,virtualgr,"Moderna comes to publicity again https://t.co/iOAzA98DKw
due to contract with the US government https://t.co/BMQlAwoJKW

#covid19 #moderna #vaccine #healthsystem #goodnews https://t.co/6kF8WAIeyX",2020-03-31
1244887706330468355,https://twitter.com/yamanemasaki/status/1244887706330468355,yamanemasaki,"J&amp;J, Moderna sign deals with U.S. to produce huge quantity of possible coronavirus vaccines | Article [AMP] | Reuters https://t.co/sgKdwp1vFW",2020-03-31
1244878933046128643,https://twitter.com/nonsellcom/status/1244878933046128643,nonsellcom,"Firms sign deals with U.S. to prep for mass-producing virus vaccines - https://t.co/2W3BN9wz33
The U.S. government has cut deals with Johnson &amp; Johnson and Moderna Inc. and sai...",2020-03-31
1244865769583697921,https://twitter.com/manatweets/status/1244865769583697921,manatweets,"☑ J&amp;J, Moderna sign deals with U.S. to produce possible coronavirus vaccines #BreakingNews #Reuters ➡ https://t.co/5TuqTw89pm https://t.co/tLGXYXwzaT",2020-03-31
1244857626413936646,https://twitter.com/malaymail/status/1244857626413936646,malaymail,"J&amp;J, Moderna sign deals with US to produce huge quantity of possible Covid-19 vaccines | Malay Mail https://t.co/l4TJOBCCj4",2020-03-31
