id,permalink,username,text,date
1245132825894031361,https://twitter.com/fintechnewshub/status/1245132825894031361,fintechnewshub,"JNJ, MRNA Stocks Down 1.5%, J&amp;J, Moderna to Produce Possible COVID-19 Vaccine https://t.co/I0QfhLRIhB",2020-03-31
1245132215010430976,https://twitter.com/moderndemerda/status/1245132215010430976,moderndemerda,como diria a poeta moderna billie eilish I'm so bored,2020-03-31
1245117218708480001,https://twitter.com/MITdeptofBE/status/1245117218708480001,MITdeptofBE,A variety of companies with MIT BE ties are working to address aspects of the Covid-19 pandemic. https://t.co/lbhBVuBiwo @moderna_tx @Alnylam @BiobotAnalytics https://t.co/T81NFTPcJf,2020-03-31
1245112477622231041,https://twitter.com/civic2115/status/1245112477622231041,civic2115,"J&amp;J, Moderna sign deals with U.S. to produce huge quantity of possible coronavirus vaccines https://t.co/T0rHUpXRqD via @YahooFinance",2020-03-31
1245111224930615296,https://twitter.com/Pipoca_Moderna/status/1245111224930615296,Pipoca_Moderna,"HBO adia minissérie I Know This Much Is True, estrelada por Mark Rufallo https://t.co/XLEhypesym",2020-03-31
1245110752840744961,https://twitter.com/lvblanchett/status/1245110752840744961,lvblanchett,Boston-based biotech firm Moderna is about to enter human trials for #COVID19 vaccine,2020-03-31
1245102833277571079,https://twitter.com/olewin/status/1245102833277571079,olewin,"We should all thank these people who are going to test the genetic (!) vaccine against #corona: ""Why I am volunteering to get the #coronavirus vaccine"" https://t.co/zdJoYRINIf #Moderna",2020-03-31
1245096058788642816,https://twitter.com/fintechcrier/status/1245096058788642816,fintechcrier,"JNJ, MRNA Stocks Down 1.5%, J&amp;J, Moderna to Produce Possible COVID-19 Vaccine  https://t.co/sqLsBpAlrA",2020-03-31
1245095835840348161,https://twitter.com/MikeRod396/status/1245095835840348161,MikeRod396,So fuck the smaller pharma companies that have actually started trials like moderna and innovio? This fucking orange is a suck up to big coporations https://t.co/9Y66eeKxf9,2020-03-31
1245095285078069253,https://twitter.com/blockenquirer/status/1245095285078069253,blockenquirer,"JNJ, MRNA Stocks Down 1.5%, J&amp;J, Moderna to Produce Possible COVID-19 Vaccine  https://t.co/qYr746L49P",2020-03-31
1245094910069321729,https://twitter.com/roccodallas/status/1245094910069321729,roccodallas,"#coronavirus #coronavirusvaccine #jnjstock #jnjstockprice JNJ, MRNA Stocks Down Around 1.5%, J&amp;J and Moderna to Produce Possible COVID-19 Vaccine https://t.co/ilaM1mULTU https://t.co/1B3cFasZqJ",2020-03-31
1245094531827105794,https://twitter.com/fintechenquirer/status/1245094531827105794,fintechenquirer,"JNJ, MRNA Stocks Down 1.5%, J&amp;J, Moderna to Produce Possible COVID-19 Vaccine  https://t.co/h7dbbQWjYK",2020-03-31
1245094174967226368,https://twitter.com/AnnaGra42804623/status/1245094174967226368,AnnaGra42804623,Moderna's COVID-19 vaccine could reach healthcare workers this fall  #COVID19 #coronavirus https://t.co/c1B8dF712j,2020-03-31
1245094105069338626,https://twitter.com/stevekrohn/status/1245094105069338626,stevekrohn,"JNJ, MRNA Stocks Down Around 1.5%, J&amp;J and Moderna to Produce Possible COVID-19 Vaccine https://t.co/AQCCl58Svd https://t.co/hJjhlBAYRM",2020-03-31
1245090324487139333,https://twitter.com/cormorantbrands/status/1245090324487139333,cormorantbrands,"I think he's right, and the timeline seems realistic. Moderna will probably have a usable vaccine first, maybe by early next year (sooner for health care workers) but these guys really can make a billion doses. Some good news. https://t.co/xOmzbMRTx8",2020-03-31
1245088820057575428,https://twitter.com/MonitorAction/status/1245088820057575428,MonitorAction,"$MRNA Stephane Bancel Dumps 11K Shares of Moderna, Inc. https://t.co/1n9clB43jl",2020-03-31
1245088698280140800,https://twitter.com/webnowcompany/status/1245088698280140800,webnowcompany,"Coinspeaker JNJ, MRNA Stocks Down Around 1.5%, J&amp;#038;J and Moderna to Produce Possible COVID-19 VaccineThe U.S government has partnered Johnson &amp;#038; Joh...Read more: https://t.co/3nIENtp6U0",2020-03-31
1245086215851966465,https://twitter.com/EnzoCalamo/status/1245086215851966465,EnzoCalamo,Moderna Begins Human Trials of COVID-19 Vaccine | @scoopit https://t.co/OsxzHTody1,2020-03-31
1245082808164417541,https://twitter.com/teaching_change/status/1245082808164417541,teaching_change,"New story on NPR: HHS To Help Companies Develop COVID-19 Vaccines The Department of Health and Human Services outlined support for Moderna and Johnson &amp; Johnson, as the companies work to develop coronavirus vaccines. Beefing up manufacturing capacity is a priority.https://if…",2020-03-31
1245081673563283462,https://twitter.com/Sustainable2050/status/1245081673563283462,Sustainable2050,"Good to see the race (of more than a year) to develop a vaccine against Covid-19! Dutch pharma company Janssen V&amp;P (pay of Johnson&amp;Johnson), biotech companies @InovioPharma and Moderna, @UniofOxford, German @CureVacAG, mentioned in this @nrc article. https://t.co/eVRMSIX65E",2020-03-31
1245080229347053568,https://twitter.com/LadyVibeUK/status/1245080229347053568,LadyVibeUK,"HHS To Help Companies Develop COVID-19 Vaccines The Department of Health and Human Services outlined support for Moderna and Johnson &amp; Johnson, as the companies work to develop coronavirus vaccines. Beefing up manufacturing capacity is a priority. https://t.co/XvqGoVoetH https://t.co/sdBcgny5w9",2020-03-31
1245077956680007680,https://twitter.com/NosajxjasoN/status/1245077956680007680,NosajxjasoN,"Placed some new bets. Snapchat, Peloton, Dropbox and Moderna. Leggo.",2020-03-31
1245075647288029185,https://twitter.com/hhariri/status/1245075647288029185,hhariri,Excited about a potential vaccine appearing soon? This will definitely demotivate you and make you lose all hope. Alternatively you could consider buying stock in Moderna https://t.co/l84abDybA8,2020-03-31
1245070861616336896,https://twitter.com/gmanews/status/1245070861616336896,gmanews,"Johnson &amp; Johnson, Moderna sign deals with US to produce possible COVID-19 vaccines https://t.co/L7O7xWATsy",2020-03-31
1245069140924280835,https://twitter.com/tudor_jacob/status/1245069140924280835,tudor_jacob,HumanProgress: Moderna has begun preparing to increase production of the coronavirus vaccine that has recently entered human trials. https://t.co/rY8reduhha Good things happening.#fb,2020-03-31
1245068686324428800,https://twitter.com/FrancCrist/status/1245068686324428800,FrancCrist,"J&amp;J, Moderna sign deals with U.S. to produce huge quantity of possible coronavirus vaccines https://t.co/uQ1jn194mb",2020-03-31
1245068599087239168,https://twitter.com/RayEasterday/status/1245068599087239168,RayEasterday,Moderna (MRNA) Readies Phase 2/3 Trials of COVID-19 Vaccine Candidate Together with BARDA. @trish_regan what do you think..?  Look at stock news https://t.co/HJcyF34Tx0,2020-03-31
1245067676000702464,https://twitter.com/JulienDigoit/status/1245067676000702464,JulienDigoit,"Moderna’s SARS-CoV-2 Vaccine’s Fast Track to Clinical Trials

As Moderna's vaccine development moves at unprecedented speed, the company's CEO explains how they have moved so quickly and why he is hopeful that their pace will continue. 

https://t.co/KW8sFjEee5",2020-03-31
1245064069339635715,https://twitter.com/HumanProgress/status/1245064069339635715,HumanProgress,Moderna has begun preparing to increase production of the coronavirus vaccine that has recently entered human trials. https://t.co/LTsJDBfHGm,2020-03-31
1245063605105692673,https://twitter.com/JohnGBaresky/status/1245063605105692673,JohnGBaresky,"Moderna and BARDA Sign COVID-19 Vaccine Development Contract
https://t.co/tweZM7vHlZ #moderna #BARDA https://t.co/vFT916G1nL",2020-03-31
1245062528939503623,https://twitter.com/moderna_records/status/1245062528939503623,moderna_records,"Jacob David has put together a lovely @Spotify playlist entitled 'Ask The Piano' :: if you have any questions for the instrument, look no further 🙂 https://t.co/sQQY19jjGX",2020-03-31
1245060680077602816,https://twitter.com/Sierra_Oracle/status/1245060680077602816,Sierra_Oracle,"One of the small companies developing trials for a  coronavirus cure is a company called Moderna, out of Massachusetts.  Est. 12 to 18 months to know if they have a cure. https://t.co/jcYSbCQ9Ym",2020-03-31
1245058898006073347,https://twitter.com/AndrewWLo/status/1245058898006073347,AndrewWLo,"How did @moderna_tx go from #COVID19 sequence to dosing first patient in vaccine trial in 63 days?! Find out tomorrow, April 1 at 4:30pm ET for @mitlfe and @MITgcfp webinar with CEO Stephane Bancel. This is no ordinary biotech company! Pls register here: https://t.co/6D7jpg6juq",2020-03-31
1245057746665431040,https://twitter.com/Pipoca_Moderna/status/1245057746665431040,Pipoca_Moderna,Andrew Jack (1944 – 2020) https://t.co/qkQ80Flayx,2020-03-31
1245051470791114752,https://twitter.com/HolHealthandMor/status/1245051470791114752,HolHealthandMor,"https://t.co/UcnzzzgY8x⁣
⁣
We are being groomed for the annual Moderna (Gates/Fauci) coronavirus vaccine. Will Gates’ “national tracking system” be… https://t.co/oXdI2ez6xU",2020-03-31
1245048026856673280,https://twitter.com/CretaRome/status/1245048026856673280,CretaRome,"The Galleria nazionale d’arte moderna contains two important works of diverse scale of Arturo Martini (1889-1947), one of the greatest Italian sculptors of the modern era who worked predominantly in terracotta. In… https://t.co/FnRqM4Dy1Z",2020-03-31
1245045723227402240,https://twitter.com/CHEManager_EU/status/1245045723227402240,CHEManager_EU,"The race to have a #COVID19 vaccine available for clinical trials is rapidly heating up. @Moderna/@NIAIDNews, @BioNTech_Group/@pfizer and @JNJNews/#BARDA all will have trials in progress this year. #coronavirus #coronavaccine https://t.co/QkMvjsSWpU",2020-03-31
1245045427675824128,https://twitter.com/LTTGeorge/status/1245045427675824128,LTTGeorge,"https://t.co/1lZJfNWRAD register for a free 2 hour stock market presentation how to beat the bear
J&amp;J, Moderna sign deals with U.S. to produce huge quantity of possible coronavirus vaccines https://t.co/ZmKnQkXfsS",2020-03-31
1245034373235294211,https://twitter.com/Cashprize/status/1245034373235294211,Cashprize,Federal health authorities plan to accelerate trials of Moderna's coronavirus vaccine https://t.co/hNzvqlJ7fY,2020-03-31
1245033394121170944,https://twitter.com/JamesonCPA/status/1245033394121170944,JamesonCPA,"The frontrunners in the race to a COVID-19 vaccine:
https://t.co/f3F3sDMRgw  #Covid19 #coronavirus #innovators  #researchers  @moderna_tx  @InovioPharma @NIH @HHSGov https://t.co/QSSXQfjp0O",2020-03-31
1245021032936849409,https://twitter.com/avoiceforchoice/status/1245021032936849409,avoiceforchoice,"""The arrangements are part of the federal government's effort to encourage drugmakers to be able to produce massive amounts of COVID-19 vaccines even before any are proven to work."" 🤔 @jandjcares @moderna_tx @NIH @realDonaldTrump https://t.co/1omsAXELdW via @YahooFinance",2020-03-31
1245013960975417344,https://twitter.com/mitsloanexperts/status/1245013960975417344,mitsloanexperts,"Wed., April 1 @ 4:30 pm ET, don’t miss the virtual fireside chat with @sbancel, CEO of @moderna_tx, &amp; @MITSloan’s @AndrewWLo. What it’s like to be the only company with a vaccine for #coronavirus currently in clinical trials at the @NIH? Watch here: https://t.co/CPUTYsa66c",2020-03-31
1245007303050485766,https://twitter.com/BioCentury/status/1245007303050485766,BioCentury,"As part of $1B initiative with @HHSGov, @JNJNews looks to dramatically scale up vaccine manufacturing; @BARDA will also collaborate with @moderna_tx to prepare late-stage testing of #COVID19  
https://t.co/NgJBNheCgn https://t.co/fzfXP1hQhE",2020-03-31
1245006574671675392,https://twitter.com/mentallion/status/1245006574671675392,mentallion,"Johnson and Johnson (In New Jersey East US and manufactured in Netherlands), Moderna sign deals with... #BreakingNews #rdt https://t.co/74ChWJNp17 https://t.co/zNXnKnfbwC",2020-03-31
1245005954053296129,https://twitter.com/InvestoPro_Com/status/1245005954053296129,InvestoPro_Com,"The #biotechnology powerhouse #Moderna, among the first company to ramp up vaccine trials against #covid19, has seen its #shares surging more than 105% over the last 6 months and closing at $30.48 yesterday 
https://t.co/8xaTnkFO9X https://t.co/SYLWBUHlw6",2020-03-31
1245003992117039106,https://twitter.com/jrtheduke/status/1245003992117039106,jrtheduke,"Johnson &amp; Johnson, Moderna sign deals with US to produce possible COVID-19 vaccines https://t.co/PWdaxNM233 via @gmanews",2020-03-31
1245003571109564417,https://twitter.com/yuheihigashi/status/1245003571109564417,yuheihigashi,"J&amp;J, Moderna sign deals with U.S. to produce huge quantity of possible coronavirus vaccines | Article [AMP] | Reuters https://t.co/OqFUlPJnwS",2020-03-31
1245003129642520577,https://twitter.com/kamareestar/status/1245003129642520577,kamareestar,"#COVID19      J&amp;J, Moderna sign deals with U.S. to produce huge quantity of possible coronavirus vaccines | Article [AMP] | Reuters https://t.co/QH1QzTk4Vx",2020-03-31
1245000099429744640,https://twitter.com/ShootinNdaGym_1/status/1245000099429744640,ShootinNdaGym_1,"I invested in JetBlue stock , medical marijuana, Moderna (who is currently testing the vaccine)",2020-03-31
1244999138250547202,https://twitter.com/belalshaykh/status/1244999138250547202,belalshaykh,"J&amp;J, Moderna sign deals with U.S. to produce huge quantity of possible coronavirus vaccines | Article [AMP] | Reuters https://t.co/eCR2AMe0XI",2020-03-31
1244997748795080704,https://twitter.com/njchamber/status/1244997748795080704,njchamber,"Pursuit of a Cure: N.J.-based Johnson &amp; Johnson and Moderna sign deals with U.S. government to produce huge quantities of possible coronavirus vaccines. Experts have said it could be 12 to 18 months before a safe, effective vaccine wins regulatory approval https://t.co/NVdi25W53P",2020-03-31
1244995609016360961,https://twitter.com/andreapaulRN/status/1244995609016360961,andreapaulRN,"DHS is working w/Janssen &amp; Moderna to accelerate the development and manufacturing of a vaccine to prevent COVID-19  The vaccine must go through the 4 phases of a clinical trial, but efficiencies will be maximized to decrease time between phases. 

https://t.co/sWTFVqR2cJ",2020-03-31
1244995478032470018,https://twitter.com/WynneHealth/status/1244995478032470018,WynneHealth,The Biomedical Advanced Research and Development Authority announced it will support vaccines in development by Janssen as well as Moderna and the National Institute of Allergy and Infectious Diseases #FDA #publichealth #COVID19 https://t.co/ntp8ZXsJD0,2020-03-31
1244995324411883523,https://twitter.com/vote4dongshen/status/1244995324411883523,vote4dongshen,"#coronavirus #COVID19
J&amp;J, Moderna sign deals with U.S. to produce huge quantity of possible coronavirus vaccines https://t.co/0EsyfQBQdo",2020-03-31
1244994939139903488,https://twitter.com/InaLionDream/status/1244994939139903488,InaLionDream,"You have what u deserve, moderna.",2020-03-31
1244994123385446408,https://twitter.com/TalkingStonks/status/1244994123385446408,TalkingStonks,Go $MRNA! Moderna headed to Phase 2 trials for #coronavirus vaccine 🎉 https://t.co/7LiTl2ReTc,2020-03-31
1244985058148134916,https://twitter.com/BosBizRowan/status/1244985058148134916,BosBizRowan,Update: Moderna is working with BARDA to prepare for Phase 2 and Phase 3 clinical trials of it mRNA vaccine for #COVID19 $MRNA https://t.co/RORkZqn9Cx,2020-03-31
1244983615802441734,https://twitter.com/christinabmoore/status/1244983615802441734,christinabmoore,"J&amp;J, Moderna sign deals with U.S. to produce huge quantity of possible coronavirus vaccines https://t.co/hSxO0Tf3aJ",2020-03-31
1244979802332786690,https://twitter.com/umichrna/status/1244979802332786690,umichrna,"#Moderna charts fast track of SARS-CoV-2 #Vaccine to clinical trials. Moderna’s platform is based on injecting #mRNA into cells to produce protein in human cells. https://t.co/HJq1kGZpFi 
#RNA #COVID19 @clinicalomics https://t.co/4ejhaz97kL",2020-03-31
1244978474051235840,https://twitter.com/homie_catnap/status/1244978474051235840,homie_catnap,Listen to Tom Adams - Particle XIX (Goodbye Berlin) by Moderna Records #np on #SoundCloud https://t.co/3DQKtVW8mw,2020-03-31
1244978194190647296,https://twitter.com/trev_jordan/status/1244978194190647296,trev_jordan,"J&amp;J, Moderna sign deals with U.S. to produce huge quantity of possible coronavirus vaccines https://t.co/WsVSztypys",2020-03-31
1244973667244621826,https://twitter.com/jmhamiltonblog/status/1244973667244621826,jmhamiltonblog,"But while J&amp;J has landed on a vaccine candidate far more quickly than usual, it is still behind Boston-based biotech Moderna. Moderna’s candidate was ready more than a month ago and entered human testing in March, six months earlier than J&amp;J planned for its potential vaccine.",2020-03-31
1244973510604148736,https://twitter.com/rtprecruiter/status/1244973510604148736,rtprecruiter,Moderna's COVID-19 vaccine could reach healthcare workers this fall  #COVID19 https://t.co/6ltzaH7ZO4,2020-03-31
1244972719059267585,https://twitter.com/TheMightyBQ/status/1244972719059267585,TheMightyBQ,"J&amp;J, Moderna sign deals with U.S. to produce huge quantity of possible coronavirus vaccines https://t.co/7GVRtH7c4I via @Reuters https://t.co/sRyJLgR1ud",2020-03-31
1244971968421658625,https://twitter.com/worldnwsdotcom/status/1244971968421658625,worldnwsdotcom,"J&amp;j, Moderna Sign Deals With U.s. To Produce Possible #covid19 Vaccines more at https://t.co/kjEHPaeuL3 https://t.co/zB4e2wOH8H",2020-03-31
1244967400396726272,https://twitter.com/djmaurovecchi/status/1244967400396726272,djmaurovecchi,"Just loved ""SPOT #1 :: DJ Knuf e Orchestra Moderna un disco a testa per un ora"" by spotradioshow on @mixcloud https://t.co/m8lVGUiJYY",2020-03-31
1244964484181037057,https://twitter.com/GeniusWorks/status/1244964484181037057,GeniusWorks,"35 of the world's leading pharma companies are racing to create a COVID-19 vaccine ... Boston’s Moderna and Tübingen’s CureVac are most advanced ... instead of using the live virus as previously, they are building up a vaccine from its genetic code: https://t.co/Du5I7JtnB9 https://t.co/vhlwaf1DBm",2020-03-31
1244964236469600256,https://twitter.com/shaunacgardner/status/1244964236469600256,shaunacgardner,"J&amp;J, Moderna sign deals with U.S. to produce huge quantity of possible coronavirus vaccines https://t.co/8RBD1HoFHz",2020-03-31
1244950967008866310,https://twitter.com/itsstevenhudson/status/1244950967008866310,itsstevenhudson,"J&amp;J, Moderna sign deals with U.S. to produce huge quantity of possible coronavirus vaccines -  https://t.co/pTBQpQyxkX",2020-03-31
1244950544000696322,https://twitter.com/SickEconomics/status/1244950544000696322,SickEconomics,"Competition for government dollars. 
This seems like an exemplary use of public/private partnership. 

Reuters: J&amp;J, Moderna sign deals with U.S. to produce huge quantity of possible coronavirus vaccines.
https://t.co/EPfLmNafoW

via @GoogleNews",2020-03-31
1244946738932113409,https://twitter.com/kashyap_world/status/1244946738932113409,kashyap_world,"MODERNA has the Corona vaccine mRNA &amp; J&amp;J a much LARGER company has similar vaccine going into TRIAL soon  !
https://t.co/zBNQrSNhxv",2020-03-31
1244942705391816704,https://twitter.com/montouche/status/1244942705391816704,montouche,"A vaccine for the Coronavirus could be well over a year away and realistically, possibly several years away, even as Boston based Moderna is ready to commence stage I human trials almost immediately. https://t.co/s4w1W8cMPa",2020-03-31
1244942516366893056,https://twitter.com/ROINJNews/status/1244942516366893056,ROINJNews,The news comes at an interesting time in the race to find a #COVID19 vaccine / @JNJNews @moderna_tx https://t.co/UFRr9bW4GT,2020-03-31
1244941523025829889,https://twitter.com/nonsellcom/status/1244941523025829889,nonsellcom,Moderna to Pause Enrollment in Some Clinical Trials as a Result of the COVID-19 Pandemic - https://t.co/ReCLY3IpUO isn’t the first drugmaker adjusting its clinical trial plans due to th...,2020-03-31
1244941329261637634,https://twitter.com/GallageAri/status/1244941329261637634,GallageAri,World should now spend more on vaccine development. #CoronavirusOutbreak @DrTedros @WHO @CEPIvaccines @moderna_tx @BillGates @melindagates @gatesfoundation,2020-03-31
1244940524487770114,https://twitter.com/ambycai/status/1244940524487770114,ambycai,"J&amp;J, Moderna sign deals with U.S. to produce huge quantity of possible #coronavirus vaccines https://t.co/u7tqSKW2AK #covid-19",2020-03-31
1244940502593671169,https://twitter.com/epab04/status/1244940502593671169,epab04,"Not now. In 2021. J&amp;J, Moderna sign deals with U.S. to produce huge quantity of possible coronavirus vaccines - Reuters https://t.co/cmKZtUoiOY",2020-03-31
1244937371851927552,https://twitter.com/CinneyZhang/status/1244937371851927552,CinneyZhang,"Moving at pandemic speed — $MRNA 8k filing: BARDA will collaborate with Moderna to prepare now for Phase 2 and Phase 3 clinical trials of the Company’s mRNA #vaccine candidate (mRNA-1273) against the novel coronavirus (SARS-CoV-2). #COVID19 

https://t.co/h7TxmIFbrN",2020-03-31
1244936943143497729,https://twitter.com/vajapeyam/status/1244936943143497729,vajapeyam,"J&amp;J, Moderna sign deals with U.S. to produce huge quantity of possible coronavirus vaccines https://t.co/QGQ7ff9FGr",2020-03-31
1244935102515367938,https://twitter.com/Biopharma_asia/status/1244935102515367938,Biopharma_asia,Moderna Provides Update on the Impact of COVID-19 on Clinical Program Development and Business Operation - https://t.co/bfzJJrdsFP,2020-03-31
1244933918177947649,https://twitter.com/salutsaota/status/1244933918177947649,salutsaota,"J&amp;J, Moderna sign deals with U.S. to produce huge quantity of possible coronavirus vaccines - Reuters https://t.co/jmtISSiMib",2020-03-31
1244931546928181249,https://twitter.com/CGTNGlobalBiz/status/1244931546928181249,CGTNGlobalBiz,"Here's the corporate headlines today:

— @Ford and @GEHealthcare to begin producing ventilators

— Johnson &amp; Johnson and #Moderna to produce coronavirus vaccines

— @Macy's says that it would furlough most of its 130,000-strong workforce https://t.co/zFfGlRToUf",2020-03-31
1244927488230330369,https://twitter.com/Pharmachina365/status/1244927488230330369,Pharmachina365,Moderna to pause certain clinical development activities amid Covid-19 https://t.co/jk8F1fF85n #COVID-19 https://t.co/A9cJgrXoyB,2020-03-31
1244925249642266624,https://twitter.com/FinanzDK/status/1244925249642266624,FinanzDK,"J&amp;J, Moderna sign deals with U.S. to produce huge quantity of possible coronavirus vaccines - https://t.co/57KfxkL97h https://t.co/g7vdyqmf8B",2020-03-31
1244924097194127360,https://twitter.com/pranav_268/status/1244924097194127360,pranav_268,"J&amp;J, Moderna sign deals with U.S. to produce huge quantity of possible coronavirus vaccines https://t.co/QgjXrdGb8A",2020-03-31
1244923558553321474,https://twitter.com/mnlimas/status/1244923558553321474,mnlimas,"""Why I am volunteering to get the #coronavirus vaccine"" - @techreview spoke to @ichaydon, who will soon be one of 45 people who will get an experimental #covid19 vaccine in Seattle. https://t.co/bqwWLmmVao #medtwitter @antonioregalado @moderna_tx",2020-03-31
1244921915153629185,https://twitter.com/rahulbh12/status/1244921915153629185,rahulbh12,"Will people trust them...???
Few years back cancerous substances were found in skin products of babies.... and now J&amp;J  wants to produce Covid-19 vaccines👇

J&amp;J, Moderna sign deals with U.S. to produce huge quantity of possible coronavirus vaccines https://t.co/JkhflXWvKW",2020-03-31
1244917546383364096,https://twitter.com/btjp01/status/1244917546383364096,btjp01,"J&amp;J, Moderna sign deals with U.S. to produce huge quantity of possible coronavirus vaccines | Article [AMP] | Reuters 
https://t.co/mnT6hvMDSg
#JNJ_N: #NYSE #vaccines #Sept. #US #news 
FYI : 
JNJ.N:NYSE - CNBC
https://t.co/9RtiklNcMa",2020-03-31
1244915018912665602,https://twitter.com/EggmanOrWalrus/status/1244915018912665602,EggmanOrWalrus,"J&amp;J, Moderna sign deals with U.S. to produce possible coronavirus vaccines https://t.co/TrOoiil4bx #populism",2020-03-31
1244914939103305728,https://twitter.com/297katrina/status/1244914939103305728,297katrina,Moderna's Covid-19 Vaccine Uses Aborted Fetal Cells https://t.co/Gp9mXTQYiT,2020-03-31
1244914644117946368,https://twitter.com/ElectronicMehta/status/1244914644117946368,ElectronicMehta,"God Speed to - J&amp;J, Moderna sign deals with U.S. to produce huge quantity of possible coronavirus vaccines https://t.co/ZCjrjUN0Ef",2020-03-31
1244914022262214656,https://twitter.com/InsidrFinancial/status/1244914022262214656,InsidrFinancial,"For investors looking to play the coronavirus outbreak, there’s no better play than $MRNA 

$INO $IBIO $OPK $CODX $AMRN $NWBO $NNVC $ACST

#biotech #stocks #pennystocks #news #moderna #mrna #nasdaq #coronavirus #covid19 https://t.co/qKuIvC7JWS",2020-03-31
1244910709244407809,https://twitter.com/ReendexNews/status/1244910709244407809,ReendexNews,"J&amp;J, Moderna sign deals with U.S. to produce huge quantity of possible coronavirus vaccines https://t.co/AJXaIcBjYN",2020-03-31
1244910595037630465,https://twitter.com/ReendexNews/status/1244910595037630465,ReendexNews,"J&amp;J, Moderna sign deals with U.S. to produce huge quantity of possible coronavirus vaccines @ Johnson &amp; Johnson https://t.co/QQnilaxnlW",2020-03-31
